{
  "artifactVersion": "0.1.0", "projectId": "pilot-citation-reliability", "synthetic": false,
  "evidence": [
    { "id": "E-001", "source": "https://json-schema.org/draft/2020-12/json-schema-validation", "title": "JSON Schema Validation", "author": "A. Wright, H. Andrews, B. Hutton (editors)", "publisher": "JSON Schema project / IETF Internet-Draft", "published": "2022-06-16", "accessed": "2026-10-23", "location": "Sections 3, 7.1, 7.2.1, 7.2.2", "supportedClaims": ["C-001", "C-004"], "limitations": ["Internet-Draft/work in progress, not an RFC", "Format assertions vary by vocabulary and implementation"], "status": "accessible", "contradicts": [] },
    { "id": "E-002", "source": "https://www.w3.org/TR/prov-overview/", "title": "PROV-Overview", "author": "Paul Groth and Luc Moreau (editors)", "publisher": "W3C", "published": "2013-04-30", "accessed": "2026-10-23", "location": "Abstract and Section 1", "supportedClaims": ["C-002", "C-004"], "limitations": ["Non-normative overview", "Same standards family as E-003; not independent empirical corroboration"], "status": "accessible", "contradicts": [] },
    { "id": "E-003", "source": "https://www.w3.org/TR/prov-dm/", "title": "PROV-DM: The PROV Data Model", "author": "Luc Moreau and Paolo Missier (editors)", "publisher": "W3C", "published": "2013-04-30", "accessed": "2026-10-23", "location": "Sections 2.1 and 2.2.2 (informative overview)", "supportedClaims": ["C-003", "C-004"], "limitations": ["The cited Section 2 is informative", "A provenance record is itself an artifact needing assessment"], "status": "accessible", "contradicts": [] }
  ],
  "claims": [
    { "id": "C-001", "text": "JSON Schema checks declared constraints and can express defined semantic formats; it is too broad to say it cannot check any semantic property.", "type": "observation", "status": "verified", "evidenceIds": ["E-001"], "dependsOn": [], "contraryEvidenceIds": [], "reasoning": null, "uncertainty": "Assertion behavior depends on vocabulary/implementation; not arbitrary citation entailment" },
    { "id": "C-002", "text": "PROV describes provenance as information used to assess quality and trustworthiness.", "type": "observation", "status": "verified", "evidenceIds": ["E-002"], "dependsOn": [], "contraryEvidenceIds": [], "reasoning": null, "uncertainty": "A stated purpose is not measured empirical accuracy" },
    { "id": "C-003", "text": "PROV-DM describes provenance of provenance, including responsibility and generation context.", "type": "observation", "status": "verified", "evidenceIds": ["E-003"], "dependsOn": [], "contraryEvidenceIds": [], "reasoning": null, "uncertainty": "The cited overview is informative; provenance still needs assessment" },
    { "id": "C-004", "text": "RAMP should distinguish formal/reference checks from a separate judgment that a cited passage supports a research claim.", "type": "inference", "status": "verified", "evidenceIds": ["E-001", "E-002", "E-003"], "dependsOn": ["C-001", "C-002", "C-003"], "contraryEvidenceIds": [], "reasoning": "Declared constraints and provenance context make records inspectable; neither supplies a general entailment test for an arbitrary research claim.", "uncertainty": "Design inference from three related technical sources; no general agent-performance result" }
  ]
}
